{
  "blueprint_sha256": "3892caf87323b97e303dfbe700721ef63035ff6b7be3d0cca09b52b51f16d35d",
  "contract_version": "metadata.executable-blueprint.v1",
  "default_annotations": {
    "description": "제조 공정과 무관한 범용성 검증을 위한 주문, 상품, 환불, 목표 데이터 도메인입니다.",
    "display_name": "주문·매출 분석"
  },
  "domain_id": "order_sales",
  "environment": "test",
  "executable": {
    "aliases": {
      "dataset:orders": {
        "target_key": "orders",
        "target_type": "dataset",
        "values": [
          "주문",
          "판매",
          "매출 데이터"
        ]
      },
      "dataset:products": {
        "target_key": "products",
        "target_type": "dataset",
        "values": [
          "상품",
          "제품 마스터"
        ]
      },
      "dataset:refunds": {
        "target_key": "refunds",
        "target_type": "dataset",
        "values": [
          "환불",
          "반품"
        ]
      },
      "dataset:targets": {
        "target_key": "targets",
        "target_type": "dataset",
        "values": [
          "목표",
          "매출 목표"
        ]
      },
      "field:PRODUCT_ID": {
        "target_key": "PRODUCT_ID",
        "target_type": "field",
        "values": [
          "상품",
          "상품 ID"
        ]
      },
      "field:PRODUCT_NAME": {
        "target_key": "PRODUCT_NAME",
        "target_type": "field",
        "values": [
          "상품명",
          "제품명"
        ]
      },
      "metric:REFUND_AMOUNT": {
        "target_key": "REFUND_AMOUNT",
        "target_type": "metric",
        "values": [
          "환불액",
          "환불금액"
        ]
      },
      "metric:SALES_AMOUNT": {
        "target_key": "SALES_AMOUNT",
        "target_type": "metric",
        "values": [
          "매출",
          "매출액",
          "주문금액"
        ]
      },
      "metric:TARGET_AMOUNT": {
        "target_key": "TARGET_AMOUNT",
        "target_type": "metric",
        "values": [
          "목표",
          "목표금액",
          "목표액"
        ]
      }
    },
    "contract_version": "metadata.authoring.draft.v1",
    "datasets": {
      "orders": {
        "config_ref": "config:dummy:order_sales@1",
        "date_policy": {
          "field": "ORDER_DATE",
          "inclusive_end": true,
          "inclusive_start": true,
          "timezone": "Asia/Seoul"
        },
        "default_detail_fields": [
          "ORDER_ID",
          "ORDER_DATE",
          "CUSTOMER_ID",
          "PRODUCT_ID",
          "SALES_AMOUNT"
        ],
        "display_name": "주문",
        "family": "sales_actual",
        "fields": {
          "CUSTOMER_ID": {
            "aliases": [
              "고객",
              "고객 ID"
            ],
            "physical_column": "customer_id",
            "roles": [
              "filter",
              "group",
              "join",
              "project",
              "output"
            ],
            "semantic_type": "identifier"
          },
          "ORDER_DATE": {
            "aliases": [
              "주문일",
              "날짜"
            ],
            "nullable": false,
            "physical_column": "order_date",
            "required_in_source": true,
            "roles": [
              "filter",
              "group",
              "sort",
              "project",
              "output"
            ],
            "semantic_type": "LocalDate",
            "timezone": "Asia/Seoul"
          },
          "ORDER_ID": {
            "aliases": [
              "주문번호",
              "order id"
            ],
            "nullable": false,
            "physical_column": "order_id",
            "required_in_source": true,
            "roles": [
              "filter",
              "join",
              "project",
              "output"
            ],
            "semantic_type": "identifier"
          },
          "PRODUCT_ID": {
            "aliases": [
              "상품",
              "상품 ID"
            ],
            "nullable": false,
            "physical_column": "product_id",
            "required_in_source": true,
            "roles": [
              "filter",
              "group",
              "join",
              "project",
              "output"
            ],
            "semantic_type": "identifier"
          },
          "SALES_AMOUNT": {
            "aliases": [
              "매출",
              "주문금액",
              "판매금액"
            ],
            "allowed_rollups": [
              "sum",
              "mean",
              "min",
              "max"
            ],
            "nullable": false,
            "physical_column": "sales_amount",
            "required_in_source": true,
            "roles": [
              "filter",
              "aggregate",
              "compare",
              "sort",
              "rank",
              "metric",
              "project",
              "output"
            ],
            "semantic_type": "currency",
            "unit": "KRW"
          }
        },
        "parameters": {
          "DATE_FROM": {
            "required": false,
            "type": "LocalDate"
          },
          "DATE_TO": {
            "required": false,
            "type": "LocalDate"
          }
        },
        "query_ref": "query:orders@1",
        "read_policy": {
          "max_rows": 50000,
          "read_only": true,
          "timeout_seconds": 30
        },
        "source_adapter": "dummy.orders.v1",
        "source_type": "dummy",
        "time_scope": "history"
      },
      "products": {
        "config_ref": "config:dummy:order_sales@1",
        "date_policy": {},
        "default_detail_fields": [
          "PRODUCT_ID",
          "PRODUCT_NAME",
          "CATEGORY"
        ],
        "display_name": "상품 마스터",
        "family": "product_master",
        "fields": {
          "CATEGORY": {
            "aliases": [
              "카테고리",
              "상품군"
            ],
            "physical_column": "category",
            "roles": [
              "filter",
              "group",
              "project",
              "sort",
              "output"
            ],
            "semantic_type": "string"
          },
          "PRODUCT_ID": {
            "aliases": [
              "상품",
              "상품 ID"
            ],
            "nullable": false,
            "physical_column": "product_id",
            "required_in_source": true,
            "roles": [
              "filter",
              "group",
              "join",
              "project",
              "output"
            ],
            "semantic_type": "identifier"
          },
          "PRODUCT_NAME": {
            "aliases": [
              "상품명",
              "제품명"
            ],
            "nullable": false,
            "physical_column": "product_name",
            "required_in_source": true,
            "roles": [
              "filter",
              "group",
              "project",
              "sort",
              "output"
            ],
            "semantic_type": "string"
          }
        },
        "parameters": {},
        "query_ref": "query:products@1",
        "read_policy": {
          "max_rows": 10000,
          "read_only": true,
          "timeout_seconds": 30
        },
        "source_adapter": "dummy.products.v1",
        "source_type": "dummy",
        "time_scope": "current"
      },
      "refunds": {
        "config_ref": "config:dummy:order_sales@1",
        "date_policy": {},
        "default_detail_fields": [
          "ORDER_ID",
          "PRODUCT_ID",
          "REFUND_AMOUNT"
        ],
        "display_name": "환불",
        "family": "sales_refund",
        "fields": {
          "ORDER_ID": {
            "aliases": [
              "주문번호",
              "order id"
            ],
            "nullable": false,
            "physical_column": "order_id",
            "required_in_source": true,
            "roles": [
              "filter",
              "join",
              "project",
              "output"
            ],
            "semantic_type": "identifier"
          },
          "PRODUCT_ID": {
            "aliases": [
              "상품",
              "상품 ID"
            ],
            "nullable": false,
            "physical_column": "product_id",
            "required_in_source": true,
            "roles": [
              "filter",
              "group",
              "join",
              "project",
              "output"
            ],
            "semantic_type": "identifier"
          },
          "REFUND_AMOUNT": {
            "aliases": [
              "환불액",
              "환불금액"
            ],
            "allowed_rollups": [
              "sum",
              "mean",
              "min",
              "max"
            ],
            "nullable": false,
            "physical_column": "refund_amount",
            "required_in_source": true,
            "roles": [
              "filter",
              "aggregate",
              "compare",
              "sort",
              "rank",
              "metric",
              "project",
              "output"
            ],
            "semantic_type": "currency",
            "unit": "KRW"
          }
        },
        "parameters": {},
        "query_ref": "query:refunds@1",
        "read_policy": {
          "max_rows": 50000,
          "read_only": true,
          "timeout_seconds": 30
        },
        "source_adapter": "dummy.refunds.v1",
        "source_type": "dummy",
        "time_scope": "history"
      },
      "targets": {
        "config_ref": "config:dummy:order_sales@1",
        "date_policy": {
          "field": "TARGET_DATE",
          "inclusive_end": true,
          "inclusive_start": true,
          "timezone": "Asia/Seoul"
        },
        "default_detail_fields": [
          "TARGET_DATE",
          "PRODUCT_ID",
          "TARGET_AMOUNT"
        ],
        "display_name": "상품별 매출 목표",
        "family": "sales_target",
        "fields": {
          "PRODUCT_ID": {
            "aliases": [
              "상품",
              "상품 ID"
            ],